{
  "$schema": "./corpus.schema.json",
  "schema_version": 1,
  "config_version": 2,
  "enabled": true,
  "corpus_id": "nlp-management",
  "display_name": "NLP and Text Analysis Literature",
  "spreadsheet_key": "nlp-management",
  "job_handle": "50576071-bfd0-4261-a1b7-f893037d4004",
  "initial_load": {
    "lookback_years": 10
  },
  "discovery": {
    "source_types": ["journal-article"],
    "rows_per_page": 100,
    "journals": [
      { "journal": "Academy of Management Journal", "issn": "0001-4273" },
      { "journal": "Academy of Management Review", "issn": "0363-7425" },
      { "journal": "Strategic Management Journal", "issn": "0143-2095" },
      { "journal": "Organization Science", "issn": "1047-7039" },
      { "journal": "Journal of Management", "issn": "0149-2063" },
      { "journal": "Academy of Management Annals", "issn": "1941-6520" },
      { "journal": "Administrative Science Quarterly", "issn": "0001-8392" },
      { "journal": "Personnel Psychology", "issn": "0031-5826" },
      { "journal": "Management Science", "issn": "0025-1909" },
      { "journal": "Organizational Behavior and Human Decision Processes", "issn": "0749-5978" },
      { "journal": "Journal of International Business Studies", "issn": "0047-2506" },
      { "journal": "Journal of Business Venturing", "issn": "0883-9026" },
      { "journal": "Strategic Entrepreneurship Journal", "issn": "1932-4391" },
      { "journal": "Entrepreneurship Theory and Practice", "issn": "1042-2587" },
      { "journal": "Journal of Management Studies", "issn": "0022-2380" },
      { "journal": "Organizational Research Methods", "issn": "1094-4281" },
      { "journal": "Sociological Methods & Research", "issn": "0049-1241" },
      { "journal": "Psychological Methods", "issn": "1082-989X" }
    ],
    "query_families": [
      {
        "query_id": "Q1_LEXICAL",
        "label": "Dictionary and lexical text analysis",
        "query": "CATA LIWC lexicon dictionary"
      },
      {
        "query_id": "Q2_COMPUTER_AIDED",
        "label": "Computer-aided text and content analysis",
        "query": "computer aided text analysis computerized content analysis"
      },
      {
        "query_id": "Q3_TEXT_MINING",
        "label": "Text mining and classification",
        "query": "text mining automated text classification"
      },
      {
        "query_id": "Q4_TOPIC_MODELS",
        "label": "Topic modeling",
        "query": "topic modeling latent Dirichlet allocation structural topic model"
      },
      {
        "query_id": "Q5_NLP",
        "label": "Natural language processing",
        "query": "natural language processing sentiment analysis named entity recognition coreference resolution"
      },
      {
        "query_id": "Q6_SEMANTIC",
        "label": "Embeddings and semantic methods",
        "query": "word embeddings semantic similarity word2vec BERT"
      },
      {
        "query_id": "Q7_LLM",
        "label": "Large language models",
        "query": "large language models LLM generative AI GPT transformers"
      },
      {
        "query_id": "Q8_MACHINE_LEARNING_TEXT",
        "label": "Machine learning applied to text",
        "query": "machine learning text narrative open-ended responses qualitative coding CAQDAS"
      }
    ],
    "retrieval_gate": {
      "exclude_title_prefixes": [
        "Issue Information", "Table of Contents", "Publisher Information", "Editorial Board",
        "Front Matter", "Back Matter", "Supplemental Material for", "Call for Papers",
        "Corrigendum", "Erratum", "Correction to"
      ],
      "include_any_phrases": [
        "CATA", "LIWC", "CAQDAS", "NLP", "LLM", "BERT", "GPT", "word2vec",
        "computer aided text analysis", "computer assisted text analysis",
        "computer aided content analysis", "computer assisted content analysis",
        "computational text analysis", "computational textual analysis", "text mining",
        "text classification", "automated coding", "automated content analysis",
        "topic modeling", "topic model", "latent Dirichlet allocation", "structural topic model",
        "natural language processing", "computational linguistics", "sentiment analysis",
        "named entity recognition", "information extraction", "coreference resolution",
        "word embedding", "semantic similarity", "vector space", "large language model",
        "generative AI", "generative artificial intelligence", "transformer model"
      ],
      "include_all_groups": [
        ["machine learning", "text"], ["machine learning", "language"],
        ["machine learning", "narrative"], ["machine learning", "open ended"],
        ["machine learning", "qualitative coding"], ["artificial intelligence", "qualitative coding"]
      ]
    }
  },
  "processing": {
    "classification_batch_size": 5,
    "continuation_delay_seconds": 5,
    "max_backoff_seconds": 900
  },
  "screening": {
    "version": 1,
    "objective": "Classify management and research-methods scholarship about computational analysis of natural-language text.",
    "include_when": [
      "The article develops, validates, compares, or explains a computational text or NLP method.",
      "Computational text or NLP analysis is central to the article's empirical contribution.",
      "A material computational-text component is used in a mixed-method design."
    ],
    "exclude_when": [
      "Qualitative coding, frame analysis, discourse analysis, interviews, surveys, case studies, archival documents, or a textual dependent variable are not computational text analysis by themselves.",
      "Text is mentioned or collected, but computational text analysis is not central.",
      "Do not infer a method merely because Crossref returned the article for a search query."
    ],
    "hard_exclusion_classification": "excluded_unresolved",
    "unresolved_classification": "excluded_unresolved",
    "classifications": [
      {
        "id": "candidate_methodological",
        "description": "Develops, validates, compares, or explains a computational text or NLP method.",
        "disposition": "candidate",
        "durable_exclusion": false,
        "unresolved": false
      },
      {
        "id": "candidate_substantive",
        "description": "Computational text or NLP analysis is central to the empirical contribution.",
        "disposition": "candidate",
        "durable_exclusion": false,
        "unresolved": false
      },
      {
        "id": "candidate_mixed",
        "description": "Methodological and substantive computational-text contributions are both central.",
        "disposition": "candidate",
        "durable_exclusion": false,
        "unresolved": false
      },
      {
        "id": "candidate_adjacent",
        "description": "Genuinely relevant to computational text analysis but outside the core corpus boundary.",
        "disposition": "candidate",
        "durable_exclusion": false,
        "unresolved": false
      },
      {
        "id": "excluded_not_computational_text",
        "description": "No computational analysis of natural-language text is present.",
        "disposition": "excluded",
        "durable_exclusion": true,
        "unresolved": false
      },
      {
        "id": "excluded_incidental_text",
        "description": "Text is mentioned or collected, but computational text analysis is not central.",
        "disposition": "excluded",
        "durable_exclusion": true,
        "unresolved": false
      },
      {
        "id": "excluded_unresolved",
        "description": "The available title and abstract evidence cannot establish computational text analysis.",
        "disposition": "excluded",
        "durable_exclusion": false,
        "unresolved": true
      }
    ]
  },
  "incremental_updates": {
    "overlap_days": 60,
    "minimum_gap_days": 7
  }
}
